{
  "kind": "keystone-bench-task",
  "schema_version": 1,
  "id": "smoke-change-app",
  "description": "Real-agent smoke task: one session, one file edit. Integration verification only; never benchmark evidence.",
  "statement": "statement.md",
  "sessions": [{ "id": "s1", "prompt": "session-1.md" }],
  "oracles": [
    { "id": "app-says-two", "role": "task", "command": ["{node}", "{task}/oracles/app-says-two.mjs"] },
    { "id": "readme-intact", "role": "regression", "command": ["{node}", "{task}/oracles/readme-intact.mjs"] }
  ]
}
